{
  "$schema": "https://json-schema.org/draft/2020-12/schema",
  "title": "HCRM Exact Ephemeris Ledger Entry",
  "type": "object",
  "required": ["ledger_version", "event_id", "body", "longitude_arcsec", "source", "certificate"],
  "properties": {
    "ledger_version": { "const": "hcrm-ephemeris-ledger-v1" },
    "event_id": { "type": "string" },
    "body": { "type": "string" },
    "longitude_arcsec": { "type": "string", "pattern": "^(0|[1-9][0-9]*)$" },
    "source": {
      "type": "object",
      "required": ["kind", "name", "checksum"],
      "properties": {
        "kind": { "type": "string" },
        "name": { "type": "string" },
        "checksum": { "type": "string" }
      }
    },
    "certificate": {
      "type": "object",
      "required": ["status", "notes"],
      "properties": {
        "status": { "enum": ["SYNTHETIC_DEMO", "IMPORTED_INTEGER_LEDGER", "CERTIFIED_EXACT_LEDGER"] },
        "notes": { "type": "string" }
      }
    },
    "meta": {
      "type": "object",
      "description": "Optional producer diagnostics (WP-08 addition, additive/backward-compatible — entries without `meta` remain valid). Not consumed by validateLedgerEntry/admitForCore; carried for downstream tooling (accuracy/retrograde tests, later packages) that wants speed/timescale context without recomputing it.",
      "properties": {
        "jd_tt": { "type": "number", "description": "Julian Day, Terrestrial Time, at the requested instant." },
        "delta_t_seconds": { "type": "number", "description": "TT - UT1 (approximated as TT - UTC) at the requested instant, seconds." },
        "speed_arcsec_per_day": { "type": "string", "pattern": "^-?(0|[1-9][0-9]*)$", "description": "Signed decimal-integer string: ecliptic-longitude rate of change, rounded to the nearest arcsecond/day, via central difference (+/-6h)." },
        "retrograde": { "type": "boolean", "description": "True iff the underlying (unrounded) speed is negative." }
      }
    }
  }
}
